{
  "format_version": "0.1-draft",
  "target": "trace-producer",
  "implementation": {
    "id": "promptsyntax-rs",
    "version": "0.1.0",
    "commit": "2789fac8acb810279ece887f46c025ef987ce0bf"
  },
  "results": [
    {
      "case_id": "producer-kept",
      "conformant": true,
      "diagnostics": [],
      "output": {
        "content_mode": "tiered",
        "coverage": {
          "assembly": "user-initiated-only",
          "inline_threshold_bytes": 4096,
          "profile": "trace-user-0-3-draft",
          "routing": "complete"
        },
        "events": [
          {
            "event": "inference",
            "id": "inference-kept-001",
            "kind": "user-initiated",
            "resolution": {
              "bindings": [
                {
                  "ambiguity_surfaced": false,
                  "bound": "model:example/atlas-4@2026-08-01",
                  "ref": "@model:example/atlas-4@2026-08-01!",
                  "rule": "qualified-canonical-reference"
                }
              ],
              "refusals": []
            },
            "routing": {
              "attempts": [
                {
                  "bound": "model:example/atlas-4@2026-08-01",
                  "measured": {
                    "cost_usd": 0.041,
                    "wall_time_ms": 3210
                  },
                  "outcome": "filled",
                  "ref": "@model:example/atlas-4@2026-08-01!"
                }
              ],
              "bound": "model:example/atlas-4@2026-08-01",
              "fill": [
                {
                  "applied": "model:example/atlas-4@2026-08-01",
                  "kind": "entity",
                  "policy": "strict",
                  "requested": "model:example/atlas-4@2026-08-01",
                  "status": "kept"
                },
                {
                  "applied": 0.2,
                  "kind": "parameter",
                  "name": "temperature",
                  "policy": "strict",
                  "requested": 0.2,
                  "status": "applied"
                }
              ],
              "outcome": "invoked",
              "policy": "strict",
              "requested": "@model:example/atlas-4@2026-08-01!"
            },
            "segments": [
              {
                "content": {
                  "state": "inline",
                  "text": "Summarize the report."
                },
                "i": 0,
                "id": "inference-kept-001:segment:0",
                "origin": "user-authored",
                "step": "inference-kept-001:step:user-content"
              }
            ],
            "steps": [
              {
                "id": "inference-kept-001:step:user-content",
                "kind": "user-content",
                "tier": "user"
              }
            ]
          }
        ],
        "mode": "executed",
        "ps_trace": "0.3-draft",
        "tier": "user",
        "turn": "turn-producer-kept-001",
        "venue": {
          "capability_document": "https://venue.example/ps-capabilities/0.3.json",
          "id": "venue:example",
          "vendor_profile": "vendor-profile/example-2026-08"
        }
      }
    },
    {
      "case_id": "producer-fallback",
      "conformant": true,
      "diagnostics": [],
      "output": {
        "content_mode": "tiered",
        "coverage": {
          "assembly": "user-initiated-only",
          "inline_threshold_bytes": 4096,
          "routing": "complete"
        },
        "events": [
          {
            "event": "inference",
            "id": "inference-fallback-001",
            "kind": "user-initiated",
            "resolution": {
              "bindings": [
                {
                  "ambiguity_surfaced": false,
                  "bound": "model:example/atlas-4@2026-08-01",
                  "ref": "@model:example/atlas-4@2026-08-01!",
                  "rule": "qualified-canonical-reference"
                },
                {
                  "ambiguity_surfaced": false,
                  "bound": "model:example/atlas-mini@2026-08-01",
                  "ref": "@model:example/atlas-mini@2026-08-01",
                  "rule": "qualified-canonical-reference"
                }
              ],
              "refusals": []
            },
            "routing": {
              "attempts": [
                {
                  "outcome": "failed",
                  "reasons": [
                    "ENTITY_UNAVAILABLE"
                  ],
                  "ref": "@model:example/atlas-4@2026-08-01!"
                },
                {
                  "bound": "model:example/atlas-mini@2026-08-01",
                  "measured": {
                    "cost_usd": 0.009,
                    "wall_time_ms": 1410
                  },
                  "outcome": "filled",
                  "ref": "@model:example/atlas-mini@2026-08-01"
                }
              ],
              "bound": "model:example/atlas-mini@2026-08-01",
              "fill": [
                {
                  "applied": "model:example/atlas-mini@2026-08-01",
                  "kind": "entity",
                  "policy": "strict",
                  "requested": "model:example/atlas-4@2026-08-01",
                  "route_step": 1,
                  "status": "fallback"
                }
              ],
              "outcome": "invoked",
              "policy": "strict",
              "requested": "@model:example/atlas-4@2026-08-01! else @model:example/atlas-mini@2026-08-01"
            },
            "segments": [
              {
                "content": {
                  "state": "inline",
                  "text": "Summarize the customer notes."
                },
                "i": 0,
                "id": "inference-fallback-001:segment:0",
                "origin": "user-authored",
                "step": "inference-fallback-001:step:user-content"
              }
            ],
            "steps": [
              {
                "id": "inference-fallback-001:step:user-content",
                "kind": "user-content",
                "tier": "user"
              }
            ]
          }
        ],
        "mode": "executed",
        "ps_trace": "0.3-draft",
        "tier": "user",
        "turn": "turn-producer-fallback-001",
        "venue": {
          "capability_document": "https://venue.example/ps-capabilities/0.3.json",
          "id": "venue:example"
        }
      }
    },
    {
      "case_id": "producer-substituted",
      "conformant": true,
      "diagnostics": [],
      "output": {
        "content_mode": "tiered",
        "coverage": {
          "assembly": "user-initiated-only",
          "inline_threshold_bytes": 4096,
          "routing": "complete"
        },
        "events": [
          {
            "event": "inference",
            "id": "inference-substituted-001",
            "kind": "user-initiated",
            "resolution": {
              "bindings": [
                {
                  "ambiguity_surfaced": false,
                  "bound": "model:example/atlas-4@2026-08-01",
                  "ref": "@model:example/atlas-4@2026-08-01",
                  "rule": "qualified-canonical-reference"
                },
                {
                  "ambiguity_surfaced": false,
                  "bound": "model:example/atlas-mini@2026-08-01",
                  "ref": "model:example/atlas-mini@2026-08-01",
                  "rule": "venue-best-effort-substitution"
                }
              ],
              "refusals": []
            },
            "routing": {
              "attempts": [
                {
                  "bound": "model:example/atlas-mini@2026-08-01",
                  "measured": {
                    "cost_usd": 0.008,
                    "wall_time_ms": 1330
                  },
                  "outcome": "filled",
                  "ref": "@model:example/atlas-4@2026-08-01"
                }
              ],
              "bound": "model:example/atlas-mini@2026-08-01",
              "fill": [
                {
                  "applied": "model:example/atlas-mini@2026-08-01",
                  "deciding_authority": "venue-operations",
                  "kind": "entity",
                  "policy": "best-effort",
                  "reason": "ENTITY_SUBSTITUTED",
                  "requested": "model:example/atlas-4@2026-08-01",
                  "status": "substituted"
                }
              ],
              "outcome": "invoked",
              "policy": "best-effort",
              "requested": "@model:example/atlas-4@2026-08-01"
            },
            "segments": [
              {
                "content": {
                  "state": "inline",
                  "text": "Summarize the risk report."
                },
                "i": 0,
                "id": "inference-substituted-001:segment:0",
                "origin": "user-authored",
                "step": "inference-substituted-001:step:user-content"
              }
            ],
            "steps": [
              {
                "id": "inference-substituted-001:step:user-content",
                "kind": "user-content",
                "tier": "user"
              }
            ]
          }
        ],
        "mode": "executed",
        "ps_trace": "0.3-draft",
        "tier": "user",
        "turn": "turn-producer-substituted-001",
        "venue": {
          "capability_document": "https://venue.example/ps-capabilities/0.3.json",
          "id": "venue:example"
        }
      }
    },
    {
      "case_id": "producer-refused",
      "conformant": true,
      "diagnostics": [],
      "output": {
        "content_mode": "tiered",
        "coverage": {
          "assembly": "user-initiated-only",
          "inline_threshold_bytes": 4096,
          "routing": "complete"
        },
        "events": [
          {
            "event": "inference",